Service;Unit;Contact;Audience;Phase;URL;Latitude;Longitude;Office;Description
SCITAS File Systems - /export;SCITAS;support@epfl.ch;Researchers;Use & Store;https://scitas-doc.epfl.ch/storage/export_fs/;46.519949;6.566748;ME B2 94.4;Espace de stockage partagé pour les données de travail. Il permet de rendre des fichiers accessibles entre utilisateurs et systèmes. Il est utilisé pour faciliter les échanges de données dans les environnements de calcul.
SCITAS File Systems - /home;SCITAS;support@epfl.ch;Researchers;Use & Store;https://scitas-doc.epfl.ch/storage/home_fs/;46.519949;6.566748;ME B2 94.4;Espace de stockage personnel pour utilisateurs HPC. Il permet de conserver des fichiers individuels de manière sécurisée. Il est utilisé pour stocker des données personnelles liées aux activités de calcul.
SCITAS File Systems - /scratch;SCITAS;support@epfl.ch;Researchers;Use & Store;https://scitas-doc.epfl.ch/storage/scratch_fs/;46.519949;6.566748;ME B2 94.4;Espace de stockage temporaire à haute performance. Il permet de manipuler des données intermédiaires lors des calculs. Il est utilisé pour des traitements intensifs nécessitant un accès rapide aux données.
SCITAS File Systems - /transfer;SCITAS;support@epfl.ch;Researchers;Use & Store;https://scitas-doc.epfl.ch/storage/transfer_fs/;46.519949;6.566748;ME B2 94.4;Espace dédié au transfert de données. Il permet de déplacer des fichiers entre systèmes internes et externes. Il est utilisé pour faciliter les échanges de données volumineuses.
SCITAS File Systems - /work;SCITAS;support@epfl.ch;Researchers;Use & Store;https://scitas-doc.epfl.ch/storage/work_fs/;46.519949;6.566748;ME B2 94.4;Espace de stockage partagé pour projets collaboratifs. Il permet d’organiser et partager des données entre membres d’un projet. Il est utilisé pour centraliser les données de travail communes.
SLims;SV-IT;helpdesk.sv@epfl.ch;Researchers;Data Collection;https://www.epfl.ch/schools/sv/it/374-2/applications/eln-lims/;46.520704;6.563421;AAB 1 94.1;Système de gestion de laboratoire (LIMS). Il permet de suivre les échantillons et les données associées tout au long des ______ssus expérimentaux. Il est utilisé pour assurer la traçabilité et l’organisation des activités de laboratoire.
Solidipes;LSMS;guillaume.anciaux@epfl.ch;Researchers;Publication & Sharing;https://gitlab.com/solidipes/solidipes;46.52119696;6.566791263;GC A2 494;Outil de gestion et de diffusion de données scientifiques. Il permet de structurer et documenter des jeux de données. Il est utilisé pour faciliter leur publication et leur réutilisation.
Statistical Consulting Service;MATH-GE;stat.consulting@epfl.ch;Researchers;Processing & Analysis;https://www.epfl.ch/schools/sb/research/math/statistical-consulting/;46.52007086;6.56764327;MA A1 417;Service de conseil en statistique. Il permet d’accompagner la conception d’analyses et l’interprétation des résultats. Il est utilisé pour renforcer la rigueur méthodologique des projets.
Stem Cell and Organoid Laboratory;SCOL;xavier.warot@epfl.ch;Researchers;Data Collection;https://www.epfl.ch/research/facilities/cpg/center-of-phenogenomics/organoid-laboratory-scol/;46.51995524;6.562453639;SV 1840;Laboratoire spécialisé dans les cellules souches et organoïdes. Il permet de développer et étudier des modèles biologiques complexes. Il est utilisé pour des recherches avancées en biologie cellulaire.
Stockage Objet-S3;DSI;support@epfl.ch;Researchers;Archiving;https://support.epfl.ch/epfl?id=epfl_kb_article_view&sys_kb_id=e8d10bf997fc7150e55e370f2153af5a;46.52014;6.567684;MA A0 388;Service de stockage objet compatible S3. Il permet de stocker de grandes quantités de données sous forme d’objets accessibles via API. Il est utilisé pour des applications nécessitant scalabilité et flexibilité.
Stockage SAN;DSI;support@epfl.ch;Researchers;Use & Store;https://support.epfl.ch/epfl?id=epfl_service_status&service=c3c363ecdb34c700ef64731b8c96194d;46.52014;6.567684;MA A0 388;Solution de stockage réseau haute performance. Elle permet d’accéder rapidement à des données critiques. Elle est utilisée pour des applications nécessitant des performances élevées.
Support from Center for Digital Trust;C4DT;c4dt@epfl.ch;Researchers;All;https://c4dt.epfl.ch/;46.51827888;6.562015083;BC 047;Service de support en cybersécurité et confiance numérique. Il permet d’obtenir des conseils sur la gestion des risques et la protection des données. Il est utilisé pour intégrer des bonnes pratiques de sécurité dans les projets.
SV Research Data Manager;SV-IT;helpdesk.sv@epfl.ch;Researchers;All;https://sv-it.epfl.ch;46.520704;6.563421;AAB 1 94.1;Service de support en gestion des données pour la faculté SV. Il permet d’accompagner l’organisation et la documentation des données. Il est utilisé pour améliorer les pratiques de gestion des données de recherche.
SV-Open;SV-IT;helpdesk.sv@epfl.ch;Researchers;Use & Store;https://sv-open.epfl.ch/;46.520704;6.563421;AAB 1 94.1;Plateforme de stockage et partage de données pour la faculté SV. Elle permet de déposer et rendre accessibles des fichiers. Elle est utilisée pour faciliter la collaboration et le partage de données.
Swiss Data Custodian;SDSC;contact@datascience.ch;Researchers;Publication & Sharing;https://data-custodian.gitlab.io/custodian/#;46.51881514;6.562325086;INN 218;Outil de gestion et documentation des données. Il permet de structurer les métadonnées et décrire les jeux de données. Il est utilisé pour améliorer la découvrabilité et la réutilisation.
Switch Filesender;DSI;support@epfl.ch;Researchers;Use & Store;https://filesender.switch.ch/;46.52014;6.567684;MA A0 388;Service de transfert sécurisé de fichiers volumineux. Il permet d’envoyer des données via une plateforme dédiée avec accès temporaire. Il est utilisé pour partager des fichiers avec des collaborateurs externes.
SwitchDrive;DSI;support@epfl.ch;Researchers;Use & Store;https://www.switch.ch/fr/drive;46.52014;6.567684;MA A0 388;Service de stockage cloud proposé par SWITCH. Il permet de synchroniser et partager des fichiers en ligne. Il est utilisé pour accéder aux données depuis plusieurs appareils.
Technology Transfer Office;TTO;info.tto@epfl.ch;Researchers;Discover & Reuse;https://www.epfl.ch/research/technology-transfer/fr/;46.51651749;6.562053348;QIJ 1 117.02;Service de valorisation et transfert de technologie. Il permet de protéger les résultats de recherche et de soutenir leur commercialisation. Il est utilisé pour développer des collaborations avec l’industrie.
Virtual desktop infrastructure (VDI);DSI;support@epfl.ch;Researchers;Processing & Analysis;https://support.epfl.ch/epfl?id=epfl_kb_article_view&sysparm_article=KB0017020;46.52014;6.567684;MA A0 388;Infrastructure de bureaux virtuels accessibles à distance. Elle permet d’utiliser des environnements logiciels sans installation locale. Elle est utilisée pour travailler sur des applications depuis n’importe quel appareil.
X-Ray Diffraction and Surface Analytics Facility;ISIC-XRDSAP;pascal.schouwink@epfl.ch;Researchers;Data Collection;https://www.epfl.ch/schools/sb/research/isic/platforms/x-ray-diffraction-and-surface-analytics/;46.51996586;6.572432126;BCH 2111;Plateforme d’analyse par diffraction des rayons X et techniques de surface. Elle permet d’étudier la structure et les propriétés des matériaux. Elle est utilisée pour des analyses avancées en sciences des matériaux.
Zenodo EPFL Community;Library;researchdata@epfl.ch;Researchers;Publication & Sharing;https://zenodo.org/communities/epfl/;46.51866692;6.569234569;RLC D1 220;Plateforme de dépôt et partage de publications et données. Elle permet d’archiver des ressources avec attribution de DOI. Elle est utilisée pour diffuser des résultats en accès ouvert.